,date,username,text,retweets numbers
0,2016-06-30 08:58:48,thegreatcoso,El invierno mas choto en 60 años. 125 muertos de gripe. Inundaciones. meningitis . inflacion #MacriMufa,0
1,2016-06-30 08:55:14,ornerynana,Dad who fatally treated son's meningitis with home remedies sentenced to jail http://www. foxnews.com/health/2016/06 /29/dad-who-fatally-treated-sons-meningitis-with-home-remedies-sentenced-to-jail.html … via the @FoxNews Android app,0
2,2016-06-30 08:50:53,maxxgadog,Dad who fatally treated son's meningitis with home remedies sentenced to jail You can't fix stupid. http://www. foxnews.com/health/2016/06 /29/dad-who-fatally-treated-sons-meningitis-with-home-remedies-sentenced-to-jail.html …,0
3,2016-06-30 08:41:50,FOX29philly,Dad who fatally treated son's meningitis with home remedies sentenced to jail http:// bit.ly/29bSAX6 pic.twitter.com/wTtx9MSl1J,4
4,2016-06-30 08:41:18,victorincoco,#meningitis #macriMATA https:// twitter.com/OmarAliCandang a/status/748292247154745344 …,1
5,2016-06-30 08:30:30,MedLinkNeurol,RT @mnt_neurology : Special properties of pneumococci affect their ability to cause meningitis http:// mnt.to/4FGr #neurology,0
6,2016-06-30 08:25:40,zesty_health,Dad who fatally treated sons meningitis with home remedies sentenced to… #health #wellness http://www. foxnews.com/health/2016/06 /29/dad-who-fatally-treated-sons-meningitis-with-home-remedies-sentenced-to-jail.html … pic.twitter.com/677QlZpkjA,0
7,2016-06-30 08:24:47,CharlieGzzSkii,Bacterial meningitis,0
8,2016-06-30 08:13:05,Nazzadan,Ingesting THREE TABLESPOONS of the swimming venue water has a 99% chance of causing some kind of infection including fucking meningitis,0
9,2016-06-30 08:10:08,RailtownLaw,Facebook justice order in meningitis death a new approach that remains unheeded http:// ow.ly/mPBW100cYzs,0
10,2016-06-30 08:09:08,OmarAliCandanga,Fuimos 1er país de Latinoamérica en incorporar la vacuna de meningitis al calendario. Macri la sacó. Bestial. Atroz. pic.twitter.com/fNSbtrLvgW,82
11,2016-06-30 08:04:35,LostInTexas_,Dad who fatally treated son's meningitis with home remedies sentenced to jail http:// ln.is/www.fox26houst on.com/FR8Eo …,0
12,2016-06-30 08:00:02,Heissarcastic,Meningitis Destroyed Toddler's All Four Limbs And She Is Fighting Back Bravely http://www. Picsnews.in/hH8E3,2
13,2016-06-30 07:58:01,GloriaMitchell6,Dad who fatally treated son's meningitis with home remedies sentenced to jail http://www. foxnews.com/health/2016/06 /29/dad-who-fatally-treated-sons-meningitis-with-home-remedies-sentenced-to-jail.html … via the @FoxNews Android app,0
14,2016-06-30 07:55:59,rv_ireneyyy,aela bodoamat gamau mikir berat2 ntar meningitis,0
15,2016-06-30 07:55:50,raven83,"She has bacterial meningitis , blood infection, and H. flu my heart cant take much more. I was getting better and now I am not",0
16,2016-06-30 07:53:55,FeliciaMcGinty,@RutgersU All New Brunswick Undergrads need 2 b vaccinated 4 Meningitis B #GetVacced https:// twitter.com/rugetinvolved/ status/748214601892904960 …,1
17,2016-06-30 07:53:52,carm3hn,"meningitis shot, fuck u",0
18,2016-06-30 07:52:38,spittlebugs,andrew thought I had meningitis,0
19,2016-06-30 07:49:07,ri0tvansarah,"just blame the meningitis , it's alright x",0
20,2016-06-30 07:48:34,DOMSweetman,my doc thought I may have got meningitis or picked up something like that on holiday.,0
21,2016-06-30 07:47:52,rolloidapp,Descubrieron que su Hija tenía meningitis B y ahora quieren advertir a todo el mundo http:// rolloid.net/descubrieron-q ue-su-hija-tenia-meningitis-b-y-ahora-quieren-advertir-a-todo-el-mundo/ … pic.twitter.com/gMdzmxzEBa,1
22,2016-06-30 07:46:38,DOMSweetman,lol I had to get tested yesterday at the hospital just in case I had meningitis or some other virus like that!!!,0
23,2016-06-30 07:25:48,aspirtalparadgm,Is it true that blowing your nose too hard can lead to spinal meningitis ? https://www. quora.com/Is-it-true-tha t-blowing-your-nose-too-hard-can-lead-to-spinal-meningitis/answer/Connie-S-Owens?share=a8765af4 …,0
24,2016-06-30 07:21:24,MedCannabis101,Dad who fatally treated son's meningitis with home remedies sentenced to jail http://www. foxnews.com/health/2016/06 /29/dad-who-fatally-treated-sons-meningitis-with-home-remedies-sentenced-to-jail.html …,0
25,2016-06-30 07:19:23,teddymackerel,"like ive got some weird hip cramp, plus i got the meningitis b vaccine and my arm is sore",0
26,2016-06-30 07:15:56,angel_rockwell,lol finally got this stupid meningitis shot,0
27,2016-06-30 07:08:14,davidlewisbooks,Dad who fatally treated son's meningitis with home remedies sentenced to jail http://www. foxnews.com/health/2016/06 /29/dad-who-fatally-treated-sons-meningitis-with-home-remedies-sentenced-to-jail.html … via the @FoxNews Android app,2
28,2016-06-30 06:56:21,Izzzyizz__,I need to hurry and get my meningitis shots so i can get my schedule for college,0
29,2016-06-30 06:50:34,autodog5150,Dad who fatally treated son's meningitis with home remedies sentenced to jail @FoxNews App http://www. foxnews.com/health/2016/06 /29/dad-who-fatally-treated-sons-meningitis-with-home-remedies-sentenced-to-jail.html …,0
30,2016-06-30 06:41:56,agt_guadalupe,@VHMok x favor informen es cierto q sacaron del calendario la vacuna ctra el meningococo? dicen q hubo 1 muerte x meningitis d nene d 2 años,0
31,2016-06-30 06:41:47,megansagex_,"Had a meningitis jab today and ever since I've had it,I've been soo sick",0
32,2016-06-30 06:26:44,AgosTorresOchoa,"Le mandé un mail a un profe con el asunto ""dudas existenciales post meningitis by Agos"". Porque la meningitis no pudo con mi simpatía.",0
33,2016-06-30 06:23:40,jilly_bby,I got the meningitis B vaccine and now my arm feels all limp lol,0
34,2016-06-30 06:21:10,Adam_Gammie,literally just realised this said Meningitis . Meant ‘Menin Gate’,0
35,2016-06-30 06:17:20,cclapton1,¿¿¿Es que debe ser un problema de viruela o la meningitis ??? https:// twitter.com/orto1941/statu s/748255111596621824 …,0
36,2016-06-30 06:11:32,Sam_Fasbach,if i get one more email from rutgers about the stupid meningitis b vaccine i will flip,0
37,2016-06-30 06:08:24,daisisepulveda,Is it true that blowing your nose too hard can lead to spinal meningitis ? https://www. quora.com/Is-it-true-tha t-blowing-your-nose-too-hard-can-lead-to-spinal-meningitis/answer/Daisi-Jo-Pollard-Sepulveda?share=b72efbd2 …,0
38,2016-06-30 06:03:32,shelgha,Snorkelling with sharks and stingrays #beating #meningitis #disney #orlando,0
39,2016-06-30 06:03:21,LKA_PS,High Meningitis outbreak in California raises fears among gay and bi-sexual men https:// twitter.com/HIVPlusMag/sta tus/747985226819788801 …,2
40,2016-06-30 06:00:02,BarthCoNursing,Millions of teens are at risk of contracting #Meningitis . Follow this link to get more information on the risks http:// bit.ly/28Kk2d3,0
41,2016-06-30 05:54:09,AirTheReal,#NaturalRemedy Dad who fatally treated son's meningitis with home remedies sentenced to jail - Fox News http:// fxmb.info/Lh4k76 via #hng,0
42,2016-06-30 05:52:49,_ccarmonaa,I have Red Raider Orientation tomorrow and I'm barely getting my meningitis vaccine.,0
43,2016-06-30 05:51:04,OfficialJulChar,"Almost fainted after the meningitis vaccine. Still really sick, but it's better to be protected for some years.",0
44,2016-06-30 05:45:59,kaylabee623,I had to get 2 types of meningitis shots today and now I can't lift my arm,0
45,2016-06-30 05:44:08,vfsandova,sacaron del calendario de vacunación la vacuna contra el meningococo. ya se murió un nene de 2 años de meningitis . pic.twitter.com/UUCxtbquVW,0
46,2016-06-30 05:38:49,karenkelleyking,Dad who fatally treated son's meningitis with home remedies sentenced to jail http://www. foxnews.com/health/2016/06 /29/dad-who-fatally-treated-sons-meningitis-with-home-remedies-sentenced-to-jail.html … via the @FoxNews Android app,0
47,2016-06-30 05:35:06,AirTheReal,#Remedy Dad who fatally treated son's meningitis with home remedies sentenced to jail - Fox News http:// fxmb.info/Lh4T7c via #hng,0
48,2016-06-30 05:33:20,ACCESSHealth,Meningitis is still a threat Protect yourself/others Get vaccinated #StopMening Call ACCESS for appt. 1.866.267.2353 pic.twitter.com/JQ1JmFHAe3,1
49,2016-06-30 05:32:47,GTownRX,Facebook justice order in meningitis death a new approach that remains unheeded http:// buff.ly/29pFxiu,0
50,2016-06-30 05:31:25,HealthNewsBit,"#Dad fatally treated #Son 's #Meningitis #Home remedies: http://www. mambolook.com/health/disease s-conditions/meningitis … , http://www. mambolook.com pic.twitter.com/3WYdYosRNE",0
51,2016-06-30 05:30:18,NotWoodlingKarl,Honestly this meningitis shot is about to keep me from going to college,0
52,2016-06-30 05:30:16,CorralesLaw,Dad who fatally treated son's meningitis with home remedies sentenced to jail http:// buff.ly/29q9IWQ,0
53,2016-06-30 05:21:00,Adam_Gammie,battlefield a day. But we got free time in Ypres (the city) and Brugge. Also got to go to the Meningitis Gate ceremony,1
54,2016-06-30 05:18:05,fmRadioPublica,"La responsable del Programa Provincial de Inmunizaciones, Ángeles Morseletto en dialogo #NoHabraTreguaParaNadie profundiza sobre Meningitis",1
55,2016-06-30 05:14:31,_kinglae,"@lebo_mor could be meningitis , go see a doctor",0
56,2016-06-30 05:01:41,BabcockSamuel,Master how in contemplation of discourse about your mumps meningitis here and now: zbXUj,0
57,2016-06-30 05:01:35,JooheePatel16,I just had 7 tubes of blood drawn and two doses of meningitis vaccinations,0
58,2016-06-30 05:01:11,MamasyBebes,Meningitis : Controversia por la vacuna en el Reino Unido http://www. mamasybebes.com/meningitis-con troversia-la-vacuna-reino-unido/ … (Archivo),0
59,2016-06-30 05:00:00,usmle_japanese,RifampinはN. meningitis の予防に用いる,0
60,2016-06-30 04:58:28,clara210367,@JamesPurefoy @AbeCesi @amypeck2011 @hugheschris30 suspected meningitis elena please support me,1
61,2016-06-30 04:55:29,clara210367,"@JamesPurefoy hello james wishes for soon heal , for my younger daughter elena , in hospital for suspected meningitis",0
62,2016-06-30 04:54:29,ACLRC,#Facebook justice order in #meningitis #death a new approach that remains unheeded. http://www. calgaryherald.com/news/national/ facebook+justice+order+meningitis+death+approach+that+still/12023542/story.html …,0
63,2016-06-30 04:52:23,PRISSG09,@VeronicaRochaLA I read your article regarding the meningococcal meningitis outbreak in LA and I believe I have an unreported case .,0
64,2016-06-30 04:51:24,buzza1991,ere coop did u lie about meningitis @bennycoop14,0
65,2016-06-30 04:51:23,HeatherM211,LOL. I think the LP will disappear for SAH. Only benefit I see is skill maintenance for when LP really needed ( meningitis ).,1
66,2016-06-30 04:43:00,FOX26Houston,Dad who fatally treated son's meningitis with home remedies sentenced to jail http:// bit.ly/29dcWRp,1
67,2016-06-30 04:40:46,lyricdevine_,So I got my meningitis shot today and at first it didn't hurt but now I can barely move my arm,0
68,2016-06-30 04:31:09,rutgersreslife,Get vaccinated! Visit http:// health.rutgers.edu/meningitis for more information about meningitis B and the MenB vaccine. pic.twitter.com/kl2g7q41S3,1
69,2016-06-30 04:22:04,eltanomdp,Vidal sacó del calendario de vacunación la vacuna contra el meningococo.. ya se murió un nene de 2 años de meningitis ..q cambio d mierda..!,5
70,2016-06-30 04:13:42,156desu2,【感染症】ムンプスD Deafness、D Didymitis精巣炎、O Oophoritis卵巣炎、P pancereatitis、P Palsy of facial nerve、A Amylase↑、M Meningitis 、In Inapparent infection,0
71,2016-06-30 04:13:14,mikevorel,Notre Dame freshman OL @ParkerBoudreaux released from hospital after bout w/ meningitis : http://www. ndinsider.com/irishstew/notr e-dame-og-parker-boudreaux-released-from-hospital/article_f0085c9a-3e2b-11e6-b190-539669917ee1.html … pic.twitter.com/31Tz1GYPRU,5
72,2016-06-30 04:12:19,PalySant,@Tree_Ni Meningitis Espinal,1
73,2016-06-30 04:05:48,OfficialJulChar,"wish I could come, but I'm getting my meningitis shot today",0
74,2016-06-30 04:02:19,NMAtweets,NMA is comprised of 120+ people across the U.S. impacted by #meningococccal #meningitis . Hear our stories: http:// bit.ly/1DKNU4O,0
75,2016-06-30 04:00:47,AliEsq1,FoxNews: RT foxnewshealth: Dad who fatally treated son's meningitis with home remedies sentenced to jail … pic.twitter.com/Tx0sfGvIVF,0
76,2016-06-30 04:00:02,CyberAnonymous,FoxNews: RT foxnewshealth: Dad who fatally treated son's meningitis with home remedies sentenced to jail … pic.twitter.com/vfnsuUU7HH,0
77,2016-06-30 03:50:54,jasmijn02,@nicolevanas precies dát inderdaad. En helaas ben je na het doormaken van een meningitis niet immuun voor nog een meningitis . @HenrikeTerH,0
78,2016-06-30 03:49:27,runyruna,Laboratorios velices: sacan la vacuna de meningitis del calendario obligatorio y gratuito https:// twitter.com/EdgardoRovira/ status/748157606817042432 …,0
79,2016-06-30 03:48:50,Chez_Em,"1st time since Saturday, little Stan looks relaxed sleeping. Today he ate & drank, sat up & walked without collapsing TG #meningitis #dogs",0
80,2016-06-30 03:46:28,markdias,RT foxnewshealth: Dad who fatally treated son's meningitis with home remedies sentenced to jail … http:// bit.ly/294WcIP,0
81,2016-06-30 03:42:57,lauren_ozan,Why is it so hard to get a meningitis shot?,0
82,2016-06-30 03:40:29,LidiaEB,"le pregunté a mi hija si no era la del calendario,la doc. le dijo q es para otro tipo de meningitis .",0
83,2016-06-30 03:38:34,Rosstrippin,This Meningitis vaccine is making me want to join the antivaxx campaign... #sickAF,0
84,2016-06-30 03:35:31,thepridela,"Cluster F*cking a Meningitis Outbreak, DPH’s slow response http:// thepridela.com/2016/06/cluste r-fcking-meningitis-outbreak/ … pic.twitter.com/oxwpX3tXfO",1
85,2016-06-30 03:33:57,UncensoredRprt,19-month-old Ezekiel died after his parents used herbal remedies to treat his bacterial meningitis . http:// fb.me/8fbkTlBrd,0
86,2016-06-30 03:31:32,2Circulos,"La terapia de agua es efectiva para prevenir: Tuberculosis, meningitis , enfermedad de los riñones y urinarias http:// ow.ly/H72z301xg8",0
87,2016-06-30 03:31:29,dgsomucla,"Dr. Kellie Lim, who received medical training at #DGSOM , lost limbs after suffering bacterial meningitis as a child. http:// ow.ly/JHrW301ChLa",2
88,2016-06-30 03:29:02,gabiehardt,just got my meningitis shot rip my arm,0
89,2016-06-30 03:07:13,YahooForde,"OK ... Not great. Daughter recovering from meningitis , tough timing for her. But they are loving the experience, as are we.",0
90,2016-06-30 03:04:00,_twittwoo_owl_,A little update about baby Kamali. The exact strain of meningitis has been identified so he’s getting the right antibiotics now.,0
91,2016-06-30 03:03:21,kegworthfox,"Well done g,son only 6 yrs old meningitis when born only just survived now signed up for imps under 10s footy team and as his yellow belt",0
92,2016-06-30 03:00:36,RUgetinvolved,Get the meningitis B vaccine and protect yourself. More info at http:// health.rutgers.edu/meningitis/?re f=GIT … pic.twitter.com/Cy2xf091Sn,12
93,2016-06-30 03:00:12,_medjournal,Special properties of pneumococci affect their ability to cause meningitis http:// dlvr.it/Lh2D9Z,0
94,2016-06-30 02:56:33,canadanews5,Facebook justice order in meningitis death a new approach that remains unheeded http:// ow.ly/N3s1301LBgN,0
95,2016-06-30 02:50:31,btinjah,Turut berdukacita untuk tmn gue anak kostum yg MGKN mninggal krn sakit meningitis :(,0
96,2016-06-30 02:46:10,VancouverSun,Facebook justice order in meningitis death a new approach that remains unheeded http:// ow.ly/N3s1301LBgN,1
97,2016-06-30 02:42:47,YvonneMaxwell17,"Meningitis Outbreak Among Gay and Bi Men Kills One, 8 Others Hospitalized in California http://www. hivplusmag.com/treatment/2016 /6/28/meningitis-outbreak-california-among-gay-and-bi-men-raises-fears#.V3QIk4HtAiI.twitter …",0
98,2016-06-30 02:40:45,ACT4Meningitis,"Do you have our Meningitis Awareness Card yet?! Pm the page with your name , address and how many cards you... http:// fb.me/4MqQPH4WO",0
99,2016-06-30 02:36:53,KlassenBand,Facebook justice order in meningitis death a new approach that remains unheeded http:// natpo.st/293FZr5 via @nationalpost,0
100,2016-06-30 02:35:02,foxnewshealth,Dad who fatally treated son's meningitis with home remedies sentenced to jail http:// fxn.ws/29c8EK6 pic.twitter.com/q5y5ZyzerV,36
101,2016-06-30 02:31:53,andymarso,Dads who lost kids to #meningitis are some of the most powerful #vaccine advocates I've met,0
102,2016-06-30 02:26:48,LkldNow,A Watson Clinic doctor and his physician wife are promoting use of nose clips in lakes to prevent meningitis . #lkld https:// twitter.com/FOX13News/stat us/748197010440749057 …,0
103,2016-06-30 02:26:14,vilesIIaexend,meningitis,0
104,2016-06-30 02:14:23,FredaVanopoulos,Facebook justice order in meningitis death a new approach that remains unheeded http:// natpo.st/293FZr5 via @nationalpost,1
105,2016-06-30 02:12:21,lilmeeks_,about to get my second meningitis shot and I'm so mad. my arm was stiff and throbbing for 4 days!,0
106,2016-06-30 02:09:09,juancarlospaco,Sacaron del calendario de vacunación la vacuna contra la meningitis ?.,0
107,2016-06-30 02:05:10,EmmaSherriff16,@LennyHenry please share for a special little girl from Birmingham fighting meningitis https://www. gofundme.com/SuperheroBrogan,0
108,2016-06-30 02:03:53,ItsAmazing52,& get my meningitis shot,0
109,2016-06-30 02:00:17,NeurologyAssoc,Special properties of pneumococci affect their ability to cause meningitis - http://www. neurologyassociatessd.com/special-proper ties-of-pneumococci-affect-their-ability-to-cause-meningitis/ …,0
110,2016-06-30 01:59:08,fernan_w,Ni la meningitis deja las secuelas que unas palabras puede dejar!,0
111,2016-06-30 01:58:32,iyesha_duhh,Labor Day last year my best friend went to Lake Tonkawa. Shortly she came down with Viral meningitis . It is not the one you get the shot for,0
112,2016-06-30 01:56:10,lilianasirne,"Ahora quito vacunas del calendario escolar, y murieron niños x meningitis https:// twitter.com/lale1263/statu s/748197606694715392 …",3
113,2016-06-30 01:48:18,lacatamunoz,¿Qué onda los brotes de meningitis en esta época? En el colegio del hijo de nuevo hay uno,0
114,2016-06-30 01:46:34,EmmaSherriff16,@AmandaHolden please share for a special little girl fighting meningitis https://www. gofundme.com/SuperheroBrogan,0
115,2016-06-30 01:45:00,ALanders10,The damn meningitis shot hurts,0
116,2016-06-30 01:44:44,crchtjessica,Is it possible to have meningitis more then once?,0
117,2016-06-30 01:44:21,EmmaSherriff16,@MissKatiePrice please help by sharing for a special little girl fighting meningitis https://www. gofundme.com/SuperheroBrogan,0
118,2016-06-30 01:42:37,PedsofDallas,Great article advocating meningitis vaccines! http:// fb.me/Cnk67ArU,0
119,2016-06-30 01:41:52,Dani_Ducey,"I misspelt meningitis so it auto corrected to ""meme gurus""",0
120,2016-06-30 01:41:24,EmmaSherriff16,@MrPeterAndre please help by sharing for a special little girl fighting meningitis https://www. gofundme.com/SuperheroBrogan,0
121,2016-06-30 01:40:36,GeofryDryer,Special properties of pneumococci affect their ability to cause meningitis : http:// ift.tt/29aRESK,0
122,2016-06-30 01:39:50,AdeTheOba,Who took their meningitis shot?,0
123,2016-06-30 01:38:27,WebbNebebe,Anyone have experience with Steroid-Responsive Meningitis ? via /r/AskVet http:// ift.tt/29puRAs,0
124,2016-06-30 01:37:00,alesitoide,sacaron del calendario de vacunación la vacuna contra el meningococo. ya se murió un nene de 2 años de meningitis . pic.twitter.com/wA9fK7uRMM,487
125,2016-06-30 01:35:38,SFTicketsPlus,Special properties of pneumococci affect their ability to cause meningitis - Structures on the surface of pneumococci determine the ability…,0
126,2016-06-30 01:31:48,tuitCanada,Facebook justice order in meningitis death a new approach that remains unheeded http:// newss.tusueldo.com/2vd #national #news,0
127,2016-06-30 01:31:16,JuggernautFitTV,Toddler Dies From Meningitis After Being Given Herbal Remedies & Supplements: http:// youtu.be/0waeqX4HOVI?a via @YouTube,0
128,2016-06-30 01:31:11,JuggernautFitTV,I liked a @YouTube video from @juggernautfittv http:// youtu.be/0waeqX4HOVI?a Toddler Dies From Meningitis After Being Given Herbal Remedies,0
129,2016-06-30 01:30:38,Health_in_hand,Special properties of pneumococci affect their ability to cause meningitis http:// ift.tt/29aRESK http:// ift.tt/1yrfXSF,0
130,2016-06-30 01:29:55,EveryPsychology,Special properties of pneumococci affect their ability to cause meningitis http:// bit.ly/294p5FH,0
131,2016-06-30 01:29:09,iamcivilengg,Special properties of pneumococci affect their ability to cause meningitis http:// dlvr.it/Lh0kMP,0
132,2016-06-30 01:27:27,biotechIT,Special properties of pneumococci affect their ability to cause meningitis http:// ift.tt/29aRESK #onmedic #science,0
133,2016-06-30 01:27:15,pehelpblog,Special properties of pneumococci affect their ability to cause meningitis http:// ift.tt/29aRESK,0
134,2016-06-30 01:25:53,SummitNeuro,Special properties of pneumococci affect their ability to cause meningitis http:// bit.ly/295AJ2a #Medicine #Science #BrainNews,0
135,2016-06-30 01:25:40,ScienceNews365,#science Special properties of pneumococci affect their ability to cause meningitis http:// bit.ly/1LtKJvi #news #tech #ciencia,0
136,2016-06-30 01:25:19,ChiHealthMag,Why physicians are increasingly recommending vaccinating against #meningitis http:// bit.ly/1LqzJ8P,0
137,2016-06-30 01:25:14,RMCAwareness,Special properties of pneumococci affect their ability to cause meningitis http:// ift.tt/29aRESK,0
138,2016-06-30 01:24:06,LKChapman147,Special properties of pneumococci affect their ability to cause meningitis http:// ift.tt/29aRESK,0
139,2016-06-30 01:21:25,RaeannTrudeau,Special properties of pneumococci affect their ability to cause meningitis http:// ift.tt/29aRESK #psychology #health,0
140,2016-06-30 01:20:49,Psy_sa1,Special properties of pneumococci affect their ability to cause meningitis http:// ift.tt/29aRESK,0
141,2016-06-30 01:19:15,Haley_Taylor16,"Swear to god, I refused my meningitis shot at my last physical but it said I got it so I'm not complaining",0
142,2016-06-30 01:19:00,Mdabulkhair01,Special properties of pneumococci affect their ability to cause meningitis http:// ift.tt/29aRESK Science daily News,0
143,2016-06-30 01:18:59,DorsetEchoTom,Charity @MeningitisNow offers adventure activities for kids affected by meningitis . http://www. dorsetecho.co.uk/news/14582238. Charity_offers_adventure_activities_for_young_people_affected_by_meningitis/ … pic.twitter.com/fcFkORFnrR,3
144,2016-06-30 01:18:14,janvandekamp81,Special properties of pneumococci affect their ability to cause meningitis http:// ift.tt/29aRESK,0
145,2016-06-30 01:17:12,surmahealthinfo,Special properties of pneumococci affect their ability to cause meningitis http:// dlvr.it/Lh0Wbq,0
146,2016-06-30 01:15:22,Free2Treat,Special properties of pneumococci affect their ability to cause meningitis http:// bit.ly/29aT5R3 #btsm #cancer,0
147,2016-06-30 01:14:43,freebetsdir,#Health #Special properties of pneumococci affect their ability to cause meningitis https:// goo.gl/tBDaUm,0
148,2016-06-30 01:14:06,flckdotnet,Special properties of pneumococci affect their ability to cause meningitis - http:// flck.net/special-proper ties-of-pneumococci-affect-their-ability-to-cause-meningitis/ …,0
149,2016-06-30 01:12:41,thomas_mcgarry,she was always tapped nicking photos of shoes on insta saying they were hers and then lied about her brother having meningitis,0
150,2016-06-30 01:12:41,TNChristianNews,Smyrna Teen Fighting Meningitis – Murfreesboro News and Radio https:// tnchristiannews.wordpress.com/2016/06/29/smy rna-teen-fighting-meningitis-murfreesboro-news-and-radio …,0
151,2016-06-30 01:12:35,infyscience,Special properties of pneumococci affect their ability to cause meningitis http:// dlvr.it/Lh0RHY,0
152,2016-06-30 01:12:09,andrewbarnettfl,Andrew Barnett's latest: Special properties of pneumococci affect their ability to cause meningitis http:// ift.tt/29aRESK #exercise,0
153,2016-06-30 01:11:34,newsletter206,#Health #Special properties of pneumococci affect their ability to cause meningitis http:// goo.gl/XNfs5f,0
154,2016-06-30 01:11:27,jamesgreid,Special properties of pneumococci affect their ability to cause meningitis http:// dlvr.it/Lh0PrF,0
155,2016-06-30 01:11:16,TheDucit,Special properties of pneumococci affect their ability to cause meningitis http:// dlvr.it/Lh0PZt,0
156,2016-06-30 01:11:14,bimahesh,Special properties of pneumococci affect their ability to cause meningitis http:// dlvr.it/Lh0PV3,0
157,2016-06-30 01:11:13,Science_News01,Special properties of pneumococci affect their ability to cause meningitis https://www. sciencedaily.com/releases/2016/ 06/160629100216.htm?utm_source=dlvr.it&utm_medium=twitter …,0
158,2016-06-30 01:09:44,skynet_io,#skynet #ai Special properties of pneumococci affect their ability to cause meningitis http:// ift.tt/29aRESK,0
159,2016-06-30 01:07:22,AgusToriano,Tengo que dejar de ver gray's anatomy y dr. House porque no paro de flashear meningitis lupus y todo lo que suene grave,0
160,2016-06-30 01:06:19,fuerzasiempre,Retrocesos en salud. Sacan vacuna del calendario. #Meningitis #Macri https:// twitter.com/EdgardoRovira/ status/748157606817042432 …,16
161,2016-06-30 01:02:34,AaronFletcherMD,"Hearing loss, speech delay, ruptured ear drums or even meningitis can occur when ear infections become chronic. http:// ow.ly/gN9n301Eg9f",0
162,2016-06-30 00:57:09,ValeTheGinger,@marisalibertad SACAR LA VACUNA DE LA MENINGITIS TAMBIÉN! !,1
163,2016-06-30 00:49:15,BlissTabitha,Dad who fatally treated son's meningitis with home remedies sentenced to jail http://www. foxnews.com/health/2016/06 /29/dad-who-fatally-treated-sons-meningitis-with-home-remedies-sentenced-to-jail.html …,1
