,date,username,text,retweets numbers
485,2016-06-29 02:41:17,banburynews,Chemists relief as renewed stocks of meningitis vaccine become available http:// trib.al/6suS4Il,0
486,2016-06-29 02:38:49,HeartJorgista,y es que mi tia está en el hospital con meningitis avanzada #JorgeBlancoTrendy #KCAMexico,0
487,2016-06-29 02:35:28,tardeseguro,"#AHORA Dialogamos con la Dra. Ángeles Morseletto, responsable provincial del Área de Inmunizaciones. Hablamos sobre vacuna de Meningitis",0
488,2016-06-29 02:30:36,MedicalPost,‘Wilfully blind:’ Dad gets jail in son’s meningitis death; house arrest for mom. http:// bit.ly/291jNu3 gated pic.twitter.com/sXjTQddehs,1
489,2016-06-29 02:25:08,SophieMurray94,I haven't said its just babies? Ed was 18 years old when he died from meningitis ? My sister was 10 months old.,0
490,2016-06-29 02:22:12,YahooForde,"Not too well! Very proud, but tough watching them struggle. I don't recommend meningitis as part of the training regimen!",0
491,2016-06-29 02:21:50,elizabeth_b25,Smyrna Teen Fighting Meningitis http:// fb.me/4NJACY3v9,0
492,2016-06-29 02:21:41,MountainHiker2,"“ @SophieMurray94 : @MeningitisNow @EdsmumTracey pic.twitter.com/huxx4keD16 ” Remember it's not only babies that get meningitis , teenagers too",2
493,2016-06-29 02:20:02,WWSWHS,2016-17 SENIOR SHOTS — Meningitis (MCV4) All 2016-17 seniors are required to have a second dose of Meningitis ... http:// fb.me/53IaFtd4H,0
494,2016-06-29 02:19:12,ferra_fz,Yaa flu singapore lah! Ya pneumonokus! Meningitis jd bnyk! Kanker! Dulu sama skrg ituu bedaa makanyaa jgn disamain!!,0
495,2016-06-29 02:18:36,exitwombs,"gods lovely gift of meningitis to an infant put her in the grave, what a just and awesome god you idiots slave away to #GodsPrayerRoom",1
496,2016-06-29 02:11:51,Americassoul,"@CDCgov Zika is a 'virus' though it has devastating prenatal impact does it ALSO present danger to others say like mumps, meningitis or Ebola",0
497,2016-06-29 02:02:04,ushuaiaenvivo,"Muerte por meningitis : La vacuna no está en el calendario, dijo Colman mas info aca http:// ift.tt/1LBEpaY El m… pic.twitter.com/OpW5PZyWoe",0
498,2016-06-29 02:01:43,Commit2Dallas,"Visit Eastfield College TMRW 9-12pm for help w/enrollment, financial aid, transcripts, meningitis shots, and more! pic.twitter.com/XJujvtchVN",0
499,2016-06-29 02:01:03,spenguardian,Relief as chemists get renewed stock of life-saving meningitis vaccine. http://www. spenboroughguardian.co.uk/news/local/rel ief-as-chemists-get-renewed-stock-of-life-saving-meningitis-vaccine-1-7986450 … pic.twitter.com/x8TkFV40om,0
500,2016-06-29 01:58:43,SportsSciGuy_,"Meningitis vaccination, sickness bug, potential lactose intolerance…at least it's all out of the way before going abroad",0
501,2016-06-29 01:40:36,Paula_Pradines,"Una pena que por la redacción, dan a entender que hay un solo tipo de meningitis y que es se puede prevenir con una vacuna...",0
502,2016-06-29 01:23:01,_ChloMac__,My doctor just called me and said I need to get my meningitis jab ffs I thought I avoided it,0
503,2016-06-29 01:19:45,happynsadnfunny,Relief as chemists get renewed stock of life-saving meningitis vaccine http:// fb.me/4HvUgrpCn,0
504,2016-06-29 01:18:01,happynsadnfunny,Focus on meningitis http:// fb.me/7RZRCJTQf,0
505,2016-06-29 01:13:40,MaggiC7,Las secuelas de la meningitis + abuso de tolueno https:// twitter.com/sebita26s/stat us/740047621058899969 …,0
506,2016-06-29 00:55:32,GBSSupport,"Most common presentations are sepsis, pneumonia &/or meningitis , typically in young babies @PaolaBagnall @altreerose http:// gbss.org.uk/who-we-are/abo ut-gbs/infection/ …",4
507,2016-06-29 00:54:41,lindsmogan,"Went to the ER for stomach pains, left with the doctor wanting to do a spinal tap for meningitis what a summer I'm having.",0
508,2016-06-29 00:51:09,Scien_net,#Scien Successful treatment of cerebral cryptococcoma and meningitis with miconazole http:// dlvr.it/LgYMdw,0
509,2016-06-29 00:42:03,Ciksu_,"ikutla kau nak. nanti nak gi umrah ke haji ke, jangan menipu kat kad vaksin meningitis tu ye #haksmesh",0
510,2016-06-29 00:39:41,quisluber,Características especiales del neumococo afectan a su capacidad para causar meningitis http:// medicalxpress.com/news/2016-06-s pecial-properties-pneumococci-affect-ability.html … vía @medical_xpress,0
511,2016-06-29 00:33:09,USMLEbot,"<インフルエンザ桿菌> ・haEMOPhilus: Epiglottis , Meningitis ,Otitis media ,Pneumonia ・チョコレート培地＋NAD＋ヘマチン ・治療はCTRX ・予防接種…カプセル抗原(ポリサッカライド)＋ジフテリア蛋白(免疫反応喚起)",0
512,2016-06-29 00:25:48,ughbrennan,just a helpful tip for ya: do some FXCKN RESEARCH before you just go get a meningitis shot because the gov said you have to,0
513,2016-06-29 00:24:50,JOY2THAWORLDD,Meningitis vaccine for school,0
514,2016-06-29 00:16:07,insportfoto,What an idiot my Wegners showed a meningitis type rash not treated I would be dead only one doc new what it was,0
515,2016-06-29 00:16:00,trixywh,RT @BreakingWHnews : WeHo Offers List of Meningitis Vaccine Resources http:// m.tbnn.it/LgWlD4 pic.twitter.com/O9Skoa0jJy,0
516,2016-06-29 00:02:26,Twinmumanddad,Meningitis : Do you know what to look for? http://www. twinmummyanddaddy.com/2016/05/mening itis-do-you-know-what-to-look-for.html … #pbloggers #mbloggers #mummybloggers #daddybloggers #parenting,0
517,2016-06-29 00:01:22,tanyaYuh,Mom: you're gonna have to get a meningitis shot Maegan: I rather get meningitis Everyone: *gasp*,3
518,2016-06-29 00:00:22,daisyfrescaa,5 years ago today I almost died from my meningitis shots,0
519,2016-06-28 23:53:51,Derrek_Hardy,I have to get my meningitis shot today and there's a good chance that I might pass out because needles pic.twitter.com/azmesqOzIU,0
520,2016-06-28 23:27:02,smhmeow,man I got so much stuff I need to do today and my heads already killin me :( meningitis can suk a dog dick,0
521,2016-06-28 23:24:20,dannniiiiii_,when boyfriend takes you to get your meningitis shot for school>>,0
522,2016-06-28 23:22:12,Chez_Em,Stans home today! @StanleyCohenLaw @leagueofrescue They think atm Meningitis :/ pic.twitter.com/xvi9QaIxM5,0
523,2016-06-28 23:21:23,savannahdean03,"I've been sick all year mono, meningitis and now strep lovely",0
524,2016-06-28 23:20:06,BreakingWHnews,WeHo Offers List of Meningitis Vaccine Resources http:// m.tbnn.it/LgWlD4 pic.twitter.com/VE7vMORArP,0
525,2016-06-28 23:18:58,lustclouds,Just got a meningitis shot wtf shit dead hurt,0
526,2016-06-28 23:13:45,156desu2,【感染症】ムンプスD Deafness、D Didymitis精巣炎、O Oophoritis卵巣炎、P pancereatitis、P Palsy of facial nerve、A Amylase↑、M Meningitis 、In Inapparent infection,0
527,2016-06-28 23:13:34,apple_scruffs_a,Chocolate And Cheese’Spinal Meningitis (Got Me Down)' by 'Ween'. #NowPlaying pic.twitter.com/KpBUzIWMd6,0
528,2016-06-28 23:13:33,WEHOville,WeHo releases list of meningitis vaccine resources. http:// wp.me/p2Ph78-fmY,0
529,2016-06-28 23:11:02,GuardianLeyland,Relief as chemists get renewed stock of life-saving meningitis vaccine http:// trib.al/FETv0Mq,0
530,2016-06-28 23:07:33,ccuellar2011,Meningitis : Food and recipes for treating and preventing... http:// goo.gl/cBh39P via @biomanantial,0
531,2016-06-28 23:06:04,doctornowGP,We now have stock of Meningitis B vaccines and have clinic dates for both our Beaconsfield and Tring sites.,0
532,2016-06-28 23:05:07,notrdame_dp,Freshman OG Boudreaux Contracts Meningitis #freshman https:// dragplus.com/post/id/364863 27 …,0
533,2016-06-28 23:03:02,russfla,Meningitis outbreak among gay and bisexual men prompts vaccine advisory http://www. lgbtqnation.com/2016/06/mening itis-outbreak-among-gay-bisexual-men-prompts-vaccine-advisory/#.V3KDk7mIHlc.twitter …,0
534,2016-06-28 22:52:09,amaziunair,"Es batu yg terkontaminasi E. Coli dpt menyebabkan berbagai penyakit seperti diare, gagal ginjal bahkan meningitis #AyoLebihBaik #YukBersatu",0
535,2016-06-28 22:47:05,AIDSChicago,Meningitis is very serious and can be deadly. Get the facts at http:// buff.ly/28ZGjam pic.twitter.com/uNxMJ2l9IC,0
536,2016-06-28 22:45:47,DailyLEICS,LUTTERWORTH: Relief as chemists get renewed stock of life-saving meningitis vaccine http:// bit.ly/290CUnC #Leics,0
537,2016-06-28 22:40:45,ctherinehermosa,"yeah, you better. Cause i have meningitis",0
538,2016-06-28 22:32:09,GrantCoPress,Grant County Health Department reminds parents of students entering seventh or 12th grade that meningitis (MCV4)... http:// fb.me/UwmgVk1z,0
539,2016-06-28 22:16:02,medicosasesores,La meningitis es una infección bacteriana grave de las membranas que rodean el cerebro y la médula espinal #CCMATIPS #EXCELENCIAENSALUD,3
540,2016-06-28 22:12:21,AntibioticResis,Closing the Brief Case: Cryptococcus gattii Meningitis with Ventriculitis. http:// dlvr.it/LgVWbG #AMR #ABresistance,0
541,2016-06-28 22:12:18,AntibioticResis,The Brief Case: Cryptococcus gattii Meningitis with Ventriculitis. http:// dlvr.it/LgVWPj #AMR #ABresistance,0
542,2016-06-28 22:07:37,AntibioticResis,Closing the Brief Case: Cryptococcus gattii Meningitis with Ventriculitis. http:// dlvr.it/LgVPZF #AMR #ABresistance,0
543,2016-06-28 22:07:35,AntibioticResis,The Brief Case: Cryptococcus gattii Meningitis with Ventriculitis. http:// dlvr.it/LgVPSY #AMR #ABresistance,0
544,2016-06-28 22:05:25,TerrellISD,Attention parents of incoming 7th graders: All incoming 7th grade students are required to have their Meningitis ... http:// fb.me/30a4pyvJW,1
545,2016-06-28 22:03:05,MorleyOb,Relief as chemists get renewed stock of life-saving meningitis vaccine. http://www. morleyobserver.co.uk/news/local/rel ief-as-chemists-get-renewed-stock-of-life-saving-meningitis-vaccine-1-7986450 … pic.twitter.com/SDoHOV840U,0
546,2016-06-28 22:00:41,VaccineFinder,#SouthDakota : #Meningitis Vaccine Required For Middle Schools This Fall - @SDPBNews http:// ow.ly/xMDO301I9ZB,0
547,2016-06-28 21:59:16,85_5Radio,Now playing Dad gets 4 months for son's meningitis death.mp3 by !,0
548,2016-06-28 21:56:13,NWBH_childrens,Getting ready for college or uni? Make sure you have the #MenACWY vaccination #meningitis http:// bit.ly/1H9opeQ,3
549,2016-06-28 21:54:43,Eleni_taa,"> 4 casos de Meningitis B, 2 de ellos fallecieron y los otros 2 secuelas graves. Yo la estoy poniendo con >",0
550,2016-06-28 21:54:15,ConTresLetras,yo viví una experiencia muy cercana de meningitis y no he dudado,0
551,2016-06-28 21:52:44,BuckinghamLocal,Relief as chemists get renewed stock of life-saving meningitis vaccine: A leading UK health charity has welco... http:// bit.ly/290CUnC,0
552,2016-06-28 21:50:33,SleafordSt,Relief as chemists get renewed stock of life-saving meningitis vaccine http:// goo.gl/fb/vpdgJW,0
553,2016-06-28 21:49:18,AndrewCarolinas,@amesalex story idea: how many others have died of meningitis after visiting USNWC in past decade? This isn't the first case.,0
554,2016-06-28 21:46:26,leamcourier,Relief as chemists get renewed stock of life-saving meningitis vaccine. http:// trib.al/MgUB5c7 pic.twitter.com/5sDBup0ow8,1
555,2016-06-28 21:37:40,bbbpapers,Pneumococcal meningitis is promoted by single cocci expressing pilus adhesin RrgA. http:// dlvr.it/LgTvTp,0
556,2016-06-28 21:36:22,SeanChriscole,When you kick ass receiving a Meningitis boost jab yesterday. Nailed it. #BadgeOfHonour #GPBanter pic.twitter.com/rkSp6IwIq2,0
557,2016-06-28 21:30:22,spenguardian,Relief as chemists get renewed stock of life-saving meningitis vaccine. http://www. spenboroughguardian.co.uk/news/local/rel ief-as-chemists-get-renewed-stock-of-life-saving-meningitis-vaccine-1-7986450 … pic.twitter.com/7cPLIZhoE5,0
558,2016-06-28 21:28:33,badwebsites,Man who treated toddler with maple syrup for meningitis sent to jail http://www. news.com.au/lifestyle/heal th/health-problems/man-who-treated-toddler-with-maple-syrup-for-meningitis-sent-to-jail/news-story/4a0e671cff6e1678b896b5b81da3b395 …,0
559,2016-06-28 21:25:15,HealthMilestone,‘Willfully Blind’ Parents Who Let Their Toddler Son Die Of Meningitis Are Sentenced #remedies http:// ift.tt/2917Bt9,0
560,2016-06-28 21:16:12,KathleenSBarnes,Man who treated toddler with maple syrup for meningitis sent to jail http:// ift.tt/2910AIQ #Health,0
561,2016-06-28 21:10:37,AncasterV,Grantham Journal: Relief as chemists get renewed stock of life-saving meningitis va... http:// bit.ly/290CUnC : http://www. ancasterpc.org,0
562,2016-06-28 21:10:07,NewsYorkshire,Relief as chemists get renewed stock of life-saving meningitis vaccine. A leading UK health charity... http:// newsyorkshire.co.uk/t/382973,0
563,2016-06-28 21:08:30,SleafordSt,Relief as chemists get renewed stock of life-saving meningitis vaccine http:// goo.gl/fb/l9aVEP,0
564,2016-06-28 21:08:24,_chelsearose,Is the meningitis shot bad??,1
565,2016-06-28 21:07:35,cabrinana,Ya vimos cómo no funcionan con el niño que murió de meningitis en Catalunya porque sus padres eran antivacunas,0
566,2016-06-28 21:02:37,MeningitisNow,It's important to know that #meningitis is not a very contagious disease but always remember the signs & symptoms,6
567,2016-06-28 21:02:22,arturoaespanaf,@cmrondon enfermedades propias d la desnutrición neumonias meningitis y si le sumas la ausencia d vacunación no medicinas mortalidad elevada,1
568,2016-06-28 21:01:50,HospitaldeNens,Bexsero: la nueva vacuna de la meningitis B de nuevo disponible. Por @lamamapediatra http://www. dra-amalia-arce.com/2016/06/bexser o-vacuna-de-la-meningitis-b.html …,2
569,2016-06-28 21:01:12,JDRHealthcare,Did you know that we can offer a range of vaccinations to protect your health against serious illnesses like Meningitis B?,0
570,2016-06-28 21:00:28,petfulcom,Recognizing the Signs of Meningitis in Dogs http://www. petful.com/pet-health/men ingitis-in-dogs/ … pic.twitter.com/m1Llx5G9u2,0
571,2016-06-28 21:00:15,Kristine_Petful,Recognizing the Signs of Meningitis in Dogs http://www. petful.com/pet-health/men ingitis-in-dogs/ …,0
572,2016-06-28 20:59:02,TrustHomesense,"My flu has diminished from: ""Googling symptoms of bacterial meningitis "" To: Worst hangover of my life. Bring it on Tuesday.",0
573,2016-06-28 20:55:31,GranthamJournal,Relief as chemists get renewed stock of life-saving meningitis vaccine: A leading UK health charity has welco... http:// bit.ly/290M9nw,1
574,2016-06-28 20:54:37,Mercury_Kerry,Relief as chemists get renewed stock of life-saving meningitis vaccine: A leading UK health charity has welco... http:// bit.ly/290CUnC,0
575,2016-06-28 20:54:22,rugbyadv,Relief as chemists get renewed stock of life-saving meningitis vaccine http:// trib.al/S42NkzI,0
576,2016-06-28 20:54:06,NewsHorncastle,Relief as chemists get renewed stock of life-saving meningitis vaccine: A leading UK health charity has welco... http:// bit.ly/290CUnC,0
577,2016-06-28 20:53:32,MiltonKeyn_es,Relief as chemists get renewed stock of life-saving meningitis vaccine - Milton Keynes Citizen http:// ift.tt/2937PSL,0
578,2016-06-28 20:51:46,skinnergj,Special properties of pneumococci affect their ability to cause meningitis http:// medicalxpress.com/news/2016-06-s pecial-properties-pneumococci-affect-ability.html … via @skinnergj,0
579,2016-06-28 20:50:40,foxcountynews,Melton: Relief as chemists get renewed stock of life-saving meningitis vaccine http:// bit.ly/290CUnC #melton,0
580,2016-06-28 20:50:09,bt_amputation,#Meningitis #school helpful Q&A https:// twitter.com/MeningitisNow/ status/747686348065243136 …,0
581,2016-06-28 20:34:45,PandCExpress,Relief as chemists get renewed stock of life-saving meningitis vaccine. http://www. pontefractandcastlefordexpress.co.uk/news/local-new s/relief-as-chemists-get-renewed-stock-of-life-saving-meningitis-vaccine-1-7986450 … pic.twitter.com/ywH3Ce3E1a,1
582,2016-06-28 20:31:19,PGCHealth,All 7th graders must be immunized against pertussis and meningitis . Make sure your child is ready this fall pic.twitter.com/KYfutBQVz8,6
583,2016-06-28 20:31:06,TravelKlinix,Crowded living conditions - such as university dorms or military barracks - are a big risk factor for #meningitis http:// ow.ly/KHMH301EsLw,0
584,2016-06-28 20:31:06,ravigowdahealth,Crowded living conditions - such as university dorms or military barracks - are a big risk factor for #meningitis http:// ow.ly/KHMH301EsLw,0
585,2016-06-28 20:30:05,myhlth,Man who treated toddler with maple syrup for meningitis sent to jail via /r/Health http:// ift.tt/2910AIQ,0
586,2016-06-28 20:30:01,RBAdventure,"He lost his legs to meningitis , but that didn't stop @AaronPhippsGBWR summiting #Kilimanjaro http:// win.gs/1TN2RWk pic.twitter.com/APxuRM1gs3",8
587,2016-06-28 20:29:59,WakeExpress,Relief as chemists get renewed stock of life-saving meningitis vaccine. @MeningitisNow http://www. wakefieldexpress.co.uk/news/local-new s/relief-as-chemists-get-renewed-stock-of-life-saving-meningitis-vaccine-1-7986450 … pic.twitter.com/SVyv4adYR1,0
588,2016-06-28 20:29:42,_bethxn,meningitis lols,0
589,2016-06-28 20:29:09,fenlandcit,Relief as chemists get renewed stock of life-saving meningitis vaccine http:// fb.me/3SpxwPbn8,0
590,2016-06-28 20:29:07,philochsghost,Special properties of pneumococci affect their ability to cause meningitis https:// scifeeds.com/news/special-p roperties-of-pneumococci-affect-their-ability-to-cause-meningitis/ …,2
591,2016-06-28 20:29:03,Brighouse_Echo,Relief as chemists get renewed stock of life-saving meningitis vaccine: A leading UK health charity has welco... http:// bit.ly/2935kQ2,0
592,2016-06-28 20:28:55,BurnleyLocale,Relief as chemists get renewed stock of life-saving meningitis vaccine: A leading UK health charity has welco... http:// bit.ly/29jWYRm,0
593,2016-06-28 20:25:42,loverutland,Relief as chemists get renewed stock of life-saving meningitis vaccine: A leading UK hea... http:// bit.ly/290CUnC - from Rutland Times,0
594,2016-06-28 20:22:42,Spalding2day,Relief as chemists get renewed stock of life-saving meningitis vaccine http:// fb.me/8lD0II8oT,1
595,2016-06-28 20:21:58,LouthLeaderNews,Relief as chemists get renewed stock of life-saving meningitis vaccine http:// bit.ly/290CUnC,0
596,2016-06-28 20:19:34,bucks_herald,#buckinghamshire Relief as chemists get renewed stock of life-saving meningitis vaccine: A leading UK health ... http:// bit.ly/290CUnC,2
597,2016-06-28 20:18:51,BeccasBlogUK,Boots launches Meningitis B vaccine so parents can protect their kids from the deadly… http:// becca.richensblogs.com/beccas-blog/bo ots-launches-meningitis-b-vaccine-so-parents-can-protect-their-kids-from-the-deadly-disease-at-home/ … pic.twitter.com/8yPJl3drye,0
598,2016-06-28 20:15:19,StEdArrKnowsley,Getting ready for college or uni? Make sure you have the #MenACWY vaccination #meningitis http:// bit.ly/1H9opeQ,0
599,2016-06-28 20:13:15,RasenMail,Relief as chemists get renewed stock of life-saving meningitis vaccine: A leading UK health charity has welco... http:// bit.ly/290M9nw,0
600,2016-06-28 20:13:13,FleetwoodLocale,Relief as chemists get renewed stock of life-saving meningitis vaccine: A leading UK health charity has welco... http:// bit.ly/29jWYRm,0
601,2016-06-28 20:12:53,DxGusher,Relief as chemists get renewed stock of life-saving meningitis vaccine http:// trib.al/bMZZdPD,0
602,2016-06-28 20:12:11,NKTJournal,Relief as chemists get renewed stock of life-saving meningitis vaccine http:// dlvr.it/LgSMMZ,0
603,2016-06-28 20:11:12,NewsdeskHEALTH,Meningitis B: Boots reintroduce limited stock of life-saving vaccine - http:// buff.ly/2900u21 http:// buff.ly/290023Y,0
604,2016-06-28 20:10:12,haverhill,Relief as chemists get renewed stock of life-saving meningitis vaccine: A leading UK health charity has welco... http:// bit.ly/290M9nw,0
605,2016-06-28 20:09:29,fenlandcit,Relief as chemists get renewed stock of life-saving meningitis vaccine http:// goo.gl/fb/EfC238,1
606,2016-06-28 20:08:08,Mercury1712,Relief as chemists get renewed stock of life-saving meningitis vaccine: A leading UK health charity has welco... http:// bit.ly/290CUnC,0
607,2016-06-28 20:08:07,LookaburraEM,#rutland Relief as chemists get renewed stock of life-saving meningitis vaccine: A leading UK health charity ... http:// bit.ly/290CUnC,0
608,2016-06-28 20:07:51,UTAU_Cacilie,There's no way to know what kind of meningitis you or your child has without undergoing spinal fluid testing. Come here small child :),0
609,2016-06-28 20:07:22,av_vaughan,Amanda Vaughan is fundraising for Meningitis Research Foundation. Donate to Amanda's JustGiving page https://www. justgiving.com/Amanda-Vaughan 3?utm_source=Twitter&utm_medium=fundraisingpage&utm_content=Amanda-Vaughan3&utm_campaign=pfp-tweet …,0
610,2016-06-28 20:07:10,GeoffSchuler,. @DocFoster Like treating your baby's meningitis with maple syrup?,1
611,2016-06-28 20:06:48,85_5Radio,Now playing Dad gets 4 months for son's meningitis death.mp3 by !,0
612,2016-06-28 20:06:02,BurnleyExpress,Relief as chemists get renewed stock of life-saving meningitis vaccine http:// trib.al/7US9Sbv pic.twitter.com/i2fn8Q0ZmK,0
613,2016-06-28 20:06:01,GarstangNews,Relief as chemists get renewed stock of life-saving meningitis vaccine http:// trib.al/rxq5tSG,0
614,2016-06-28 20:04:24,ProMedDx,Special properties of pneumococci affect their ability to cause meningitis : Structures on the surface of pneu... http:// bit.ly/297PncJ,0
615,2016-06-28 20:03:22,DavidLogan2020,Relief as chemists get renewed stock of life-saving meningitis vaccine - Lancashire Evening Post: Lancashire ... http:// bit.ly/28ZqFGE,0
616,2016-06-28 20:03:01,STOPmeningitis,Este gran jugador de videogames perdió sus manos como secuela de una meningitis bacteriana. Ha creado este... http:// fb.me/3t1GuEsmL,0
617,2016-06-28 20:00:09,SkegStandard,Relief as chemists get renewed stock of life-saving meningitis vaccine: A leading UK health charity has welco... http:// bit.ly/290CUnC,0
618,2016-06-28 19:59:40,GarstangLocale,Relief as chemists get renewed stock of life-saving meningitis vaccine: A leading UK health charity has welco... http:// bit.ly/29jWYRm,0
619,2016-06-28 19:58:10,standardboston,Relief as chemists get renewed stock of life-saving meningitis vaccine http:// goo.gl/fb/v5W9Zr,0
620,2016-06-28 19:58:04,STOPmeningitis,Más información sobre los síntomas de la meningitis gracias a nuestros amigos de Confederation of Meningitis Organisations (CoMO),0
621,2016-06-28 19:57:51,tom_biotech,Special properties of pneumococci affect their ability to cause meningitis http:// bit.ly/29bduEK #biotech,0
622,2016-06-28 19:56:16,pendlenews,Relief as chemists get renewed stock of life-saving meningitis vaccine http:// trib.al/ZcRePB7 pic.twitter.com/sA1QFOdt06,0
623,2016-06-28 19:55:54,buryfree,Relief as chemists get renewed stock of life-saving meningitis vaccine http:// dlvr.it/LgS4p9,0
624,2016-06-28 19:54:38,fenlandcit,Relief as chemists get renewed stock of life-saving meningitis vaccine http:// goo.gl/fb/Q612sa,0
625,2016-06-28 19:54:24,mytotalhealthng,Special properties of pneumococci affect their ability to cause meningitis http:// dlvr.it/LgS37B,0
626,2016-06-28 19:52:05,banburynews,NEWS: Relief as chemists get renewed stock of life-saving meningitis vaccine: A leading UK health charity has... http:// bit.ly/294hIPd,0
627,2016-06-28 19:51:09,Diss_Express,Relief as chemists get renewed stock of life-saving meningitis vaccine http:// dlvr.it/LgS0qQ,1
628,2016-06-28 19:49:37,daventrian,#DaventryExpress Relief as chemists get renewed stock of life-saving meningitis vaccine http:// owl.li/yjbK501QuhQ,0
629,2016-06-28 19:46:57,fenlandcit,Relief as chemists get renewed stock of life-saving meningitis vaccine - Read more: http:// trib.al/1u49BHm http:// fb.me/86BdEZPLH,0
630,2016-06-28 19:46:52,Spalding2day,Relief as chemists get renewed stock of life-saving meningitis vaccine - Read more: http:// trib.al/WiwbiMo http:// fb.me/5iOcoUfpu,0
631,2016-06-28 19:46:52,PTmarkedwards,Relief as chemists get renewed stock of life-saving meningitis vaccine - Read more: http:// trib.al/hH2sJEB http:// fb.me/4XHEgabtb,0
632,2016-06-28 19:45:49,SleafordSt,Relief as chemists get renewed stock of life-saving #meningitis vaccine - Read more: http://www. peterboroughtoday.co.uk/news/relief-as -chemists-get-renewed-stock-of-life-saving-meningitis-vaccine-1-7452658 … pic.twitter.com/wIht6iuU76,0
633,2016-06-28 19:45:49,SkegStandard,Relief as chemists get renewed stock of life-saving #meningitis vaccine - Read more: http://www. peterboroughtoday.co.uk/news/relief-as -chemists-get-renewed-stock-of-life-saving-meningitis-vaccine-1-7452658 … pic.twitter.com/Fqbta17elR,0
634,2016-06-28 19:45:49,NewsHorncastle,Relief as chemists get renewed stock of life-saving #meningitis vaccine - Read more: http://www. peterboroughtoday.co.uk/news/relief-as -chemists-get-renewed-stock-of-life-saving-meningitis-vaccine-1-7452658 … pic.twitter.com/8PbvCZrIen,0
635,2016-06-28 19:45:49,Mercury1712,Relief as chemists get renewed stock of life-saving #meningitis vaccine - Read more: http://www. peterboroughtoday.co.uk/news/relief-as -chemists-get-renewed-stock-of-life-saving-meningitis-vaccine-1-7452658 … pic.twitter.com/N0hbMVusc4,0
636,2016-06-28 19:45:49,RasenMail,Relief as chemists get renewed stock of life-saving #meningitis vaccine - Read more: http://www. peterboroughtoday.co.uk/news/relief-as -chemists-get-renewed-stock-of-life-saving-meningitis-vaccine-1-7452658 … pic.twitter.com/U1TnBH5Bsy,0
637,2016-06-28 19:45:49,therutlandtimes,Relief as chemists get renewed stock of life-saving #meningitis vaccine - Read more: http://www. peterboroughtoday.co.uk/news/relief-as -chemists-get-renewed-stock-of-life-saving-meningitis-vaccine-1-7452658 … pic.twitter.com/VfX4zV9b6P,0
638,2016-06-28 19:45:49,thebournelocal,Relief as chemists get renewed stock of life-saving #meningitis vaccine - Read more: http://www. peterboroughtoday.co.uk/news/relief-as -chemists-get-renewed-stock-of-life-saving-meningitis-vaccine-1-7452658 … pic.twitter.com/lzIZ3J0uj4,0
